{
  "schema": "paravoxia.decisionBrief.v1",
  "runId": "2026-09-05-after-the-hearth",
  "authoredBy": "chapter-director",
  "authoredAt": "2026-09-06T06:44:03.439559+00:00",
  "sourceIntentRef": "story-intent.md#routed-decisions",
  "items": [
    {
      "id": "CG-S1-creative",
      "kind": "creative",
      "question": "Which story direction, voice and reveal limits govern this production draft?",
      "context": "../../story-runs/2026-09-06-common-ground/owner-standing-authority.json records the direct instruction 'yes continue, and please auto approve everything' at 2026-09-06T04:22:49.322379+00:00. This explicitly delegates necessary in-scope design, apparatus and future exact integration-subset decisions. The legacy field decidedBy=owner names the authority principal, not personal human review of later files, hashes or media. Council-v2 candidate 133d1dbe54a9f51e68d9fd67997042d1494059e30707a5da6c308d403cebc2fb and register 267ec0e8ecc8986c71b41a725e15467979704e8a6b4881bf3ab513730f391a4b have exact three-lane documentation signatures and separate delegated adoption in owner-story-decision.json at 2026-09-06T06:30:50.841372+00:00, without runtime authority. The final scene placement is measured in staged-geometry-qualification.json SHA-256 7cc0d63d843df60462a2fd55ba928bfd5656c20b4d20c31a581fec559532b7ff.",
      "options": [
        "Carry the signed council-v2 direction and qualified bounded scene bindings through the required scene gates under standing delegation"
      ],
      "recommended": "Carry the signed council-v2 direction and qualified bounded scene bindings through the required scene gates under standing delegation",
      "decidedBy": "owner",
      "status": "decided",
      "decision": "Carry all four ch13 beats, real station/movie/home restoration bridge, explicit voluntary Origin return, two complete survey route classes and persistent Origin repeat. W-7744 locally repeats his unresolved measurement; future protected recurrence stays unresolved. Terra needs his maintained reference for her own comparison, then explicitly F-offers and occupies a separate far reference for his independent test under the same range, solid sight, occupancy and clearance rule. Preserve the two new Terra lines, quiet continuous drawing, no old-copy rewrite, alive ceiling, protected mysteries, immediate handback and live-only maximum five-second final texture followed by the existing 4.5-second release, no coda/replay. This final Stage 1 packet binds the measured range, staged world placement and proof hash; no owner item or geometry selection is pending. Council-v2 documentation has exact signatures and delegated adoption; required independent council judgment and the separately signed scene contract govern opening the planning-only lock. This packet does not mutate runtime or sign that scene contract. Actual rendered body/core/apparatus, live interaction/hysteresis, edited-terrain, hardware, day/night and listening acceptance follow signed implementation.",
      "decidedAt": "2026-09-06T04:22:49.322379+00:00"
    },
    {
      "id": "CG-S1-physical-evidence",
      "kind": "creative",
      "question": "Which final measured apparatus, range and staged physical relations bind this scene?",
      "context": "../../story-runs/2026-09-06-common-ground/owner-standing-authority.json records the direct instruction 'yes continue, and please auto approve everything' at 2026-09-06T04:22:49.322379+00:00. This explicitly delegates necessary in-scope design, apparatus and future exact integration-subset decisions. The legacy field decidedBy=owner names the authority principal, not personal human review of later files, hashes or media. Final geometry-arena.md/json establishes two actual dry banks and a +16-unit / 1.44-times detour, but zero qualifying reference-separating layouts in 20,000 combinations. Range 12 fully covered long routes coexist with at most two unsupported short units; short gaps of at least six leave long coverage at best 94.03%. Range 24 fully covered long routes leave zero short gap. Witness/common stages were not reached. Topology is not the failure. The three arena-instrument-repair documents accept one explicit opaque-backed reference for measurement. The 11-frame current baseline contains no W-7744 body and no built Tidegarden core; it grounds existing world context, not nonexistent new-state blocking. The selected backed-instrument result is now PASS in staged-geometry-qualification.md/json, including the connected cap and distinct H body pose. This resolves the bounded geometry obligations without changing the preserved failed-water or prior measurement provenance.",
      "options": [
        "Bind the passed constant range 12 and exact staged geometry, retaining live acceptance after implementation"
      ],
      "recommended": "Bind the passed constant range 12 and exact staged geometry, retaining live acceptance after implementation",
      "decidedBy": "owner",
      "status": "decided",
      "decision": "Under standing delegation, bind range 12, Origin world -1,-1, R=(-34,51.05,20), yaw 90 degrees; S=(-26,51.05,12), E=(-42,51.05,12), H=(-40,51.05,12), C=(-48,51.05,12), final Terra T=(-44,51.05,12), inspection/intermediate example W=(-34,51.05,10). Exact staged proof SHA-256 7cc0d63d843df60462a2fd55ba928bfd5656c20b4d20c31a581fec559532b7ff. Short 16 units/17 samples with 14 backing-unsupported units; long 36 units/61 samples fully covered (+20 units, ratio 2.25). Common E-to-C is the actual 18-unit/31-sample detour, all 73 dense points covered from H, max distance 10.01 under 12, two-unit body clearance; eight contiguous units need the held reference. Worker physically moves E-to-H before Terra starts and H-to-E after her explicit T offer, two units each, no proof credit. The final full E-to-C test remains covered from T, max distance 7.23 and two-unit clearance. Initial actor inspection at W uses one truthful start objective at S before recording; after the real span offer, grounded actor approach to S earns no proof and frees W for optional witnessing. The world AABBs in story-intent.md and staged JSON bind backing/stand/bracket/cap identically for mesh, collision and LOS. Cap touches stand top and fixed socket with zero gap; six general symmetric endpoint-contact tests pass. No solid exemption or epsilon; walking/body collision remains inclusive. Fixed/worker/player sockets 1.30/1.85/1.35; inner witness cylinder radius 1.25/vertical 0.6 and release 1.75/0.9 unchanged. Keep both 128-sample/120-unit caps, cost-free tail revision, honest start/end witness tests, freely offered valid intermediate positions, no worldgen change or invisible restrictions. This final Stage 1 packet binds the measured range, staged world placement and proof hash; no owner item or geometry selection is pending. Council-v2 documentation has exact signatures and delegated adoption; required independent council judgment and the separately signed scene contract govern opening the planning-only lock. This packet does not mutate runtime or sign that scene contract. Actual rendered body/core/apparatus, live interaction/hysteresis, edited-terrain, hardware, day/night and listening acceptance follow signed implementation.",
      "decidedAt": "2026-09-06T06:39:43.730295+00:00"
    },
    {
      "id": "CG-S1-boundary-state",
      "kind": "boundary",
      "question": "Which new chapter modules and state/resume dispatch seams must the later signed runtime packet cover?",
      "context": "Exact future boundary inventory from integration-survey.md plus implementation-interface-plan.md and scene-contract-assembly-notes.md. ../../story-runs/2026-09-06-common-ground/owner-standing-authority.json records the direct instruction 'yes continue, and please auto approve everything' at 2026-09-06T04:22:49.322379+00:00. This explicitly delegates necessary in-scope design, apparatus and future exact integration-subset decisions. The legacy field decidedBy=owner names the authority principal, not personal human review of later files, hashes or media. New exports below are explicitly proposed interfaces, not claims that uncreated runtime symbols already exist. Each list authorizes preparation of the necessary subset; no obligation or current permission to touch every path.",
      "options": [
        "Use the smallest exact necessary subset after revised council and scene gates; preserve all unrelated dirty work"
      ],
      "recommended": "Use the smallest exact necessary subset after revised council and scene gates; preserve all unrelated dirty work",
      "paths": [
        {
          "path": "main/src/story/commonGroundState.ts",
          "symbol": "proposed COMMON_GROUND_SNAPSHOT_VERSION; TraceSample; TraceSlot; CommonGroundSnapshot; createEmptySnapshot; appendSample; reviseTail; invalidateTestedPrefix; clearUncommitted; serializeCommonGround; hydrateCommonGround; migrateCommonGround; named contract constants",
          "why": "Bounded actor/world snapshot with separate accepted survey/awaiting-start/recording state, survey class, tested prefix, actual reciprocal proof, final offer and uncredited actor positioning phase."
        },
        {
          "path": "main/src/story/commonGroundDirector.ts",
          "symbol": "proposed chapter-local enter/tick dispatch; objective facts; commit events; marker target; interaction registration; tickCommonGroundEntry",
          "why": "Own real predicates and receipt-backed Tidegarden home entry; no time-derived success."
        },
        {
          "path": "main/src/story/beats/ch13/ch13-home.ts",
          "symbol": "new defineBeat contract module scope",
          "why": "Home review and explicit return choice."
        },
        {
          "path": "main/src/story/beats/ch13/ch13-return.ts",
          "symbol": "new defineBeat contract module scope",
          "why": "Physical Origin transit and approach."
        },
        {